"annotation_id","annotator","created_at","id","label","lead_time","text","updated_at"
1354,"1","2025-08-29T11:20:25.228720Z","sms-00431","ham",1.78,"I wnt to buy a BMW car urgently..its vry urgent.but hv a shortage of  &lt;#&gt; Lacs.there is no source to arng dis amt. &lt;#&gt; lacs..thats my prob","2025-08-29T11:20:25.228744Z"
1355,"1","2025-08-29T11:20:26.329138Z","sms-00432","ham",0.892,"At home watching tv lor.","2025-08-29T11:20:26.329152Z"
1356,"1","2025-08-29T11:20:27.848400Z","sms-00433","ham",1.295,"Does she usually take fifteen fucking minutes to respond to a yes or no question","2025-08-29T11:20:27.848418Z"
1357,"1","2025-08-29T11:20:29.416405Z","sms-00434","spam",1.357,"Congrats! Nokia 3650 video camera phone is your Call 09066382422 Calls cost 150ppm Ave call 3mins vary from mobiles 16+ Close 300603 post BCM4284 Ldn WC1N3XX","2025-08-29T11:20:29.416425Z"
1358,"1","2025-08-29T11:20:30.533907Z","sms-00435","ham",0.896,"Booked ticket for pongal?","2025-08-29T11:20:30.533927Z"
1359,"1","2025-08-29T11:20:32.101998Z","sms-00436","ham",1.361,"You available now? I'm like right around hillsborough &amp;  &lt;#&gt; th","2025-08-29T11:20:32.102021Z"
1360,"1","2025-08-29T11:20:33.915906Z","sms-00437","ham",1.601,"The message sent is askin for  &lt;#&gt; dollars. Shoul i pay  &lt;#&gt;  or  &lt;#&gt; ?","2025-08-29T11:20:33.915924Z"
1361,"1","2025-08-29T11:20:35.457246Z","sms-00438","ham",1.338,"Ask g or iouri, I've told the story like ten times already","2025-08-29T11:20:35.457268Z"
1362,"1","2025-08-29T11:20:36.842126Z","sms-00439","ham",1.174,"How long does applebees fucking take","2025-08-29T11:20:36.842143Z"
1363,"1","2025-08-29T11:20:38.629178Z","sms-00440","ham",1.57,"Hi hope u get this txt~journey hasnt been gd,now about 50 mins late I think.","2025-08-29T11:20:38.629195Z"
1364,"1","2025-08-29T11:20:40.252118Z","sms-00441","ham",1.429,"But i have to. I like to have love and arrange.","2025-08-29T11:20:40.252138Z"
1365,"1","2025-08-29T11:20:42.054140Z","sms-00442","ham",1.595,"Yes..he is really great..bhaji told kallis best cricketer after sachin in world:).very tough to get out.","2025-08-29T11:20:42.054159Z"
1366,"1","2025-08-29T11:20:43.363540Z","sms-00443","ham",1.109,"You were supposed to wake ME up &gt;:(","2025-08-29T11:20:43.363555Z"
1367,"1","2025-08-29T11:20:45.130913Z","sms-00444","ham",1.573,"Oic... I saw him too but i tot he din c me... I found a group liao...","2025-08-29T11:20:45.130931Z"
1368,"1","2025-08-29T11:20:46.211905Z","sms-00445","ham",0.875,"Sorry, I'll call later","2025-08-29T11:20:46.211920Z"
1369,"1","2025-08-29T11:20:48.738067Z","sms-00446","ham",2.298,"""HEY HEY WERETHE MONKEESPEOPLE SAY WE MONKEYAROUND! HOWDY GORGEOUS, HOWU DOIN? FOUNDURSELF A JOBYET SAUSAGE?LOVE JEN XXX""","2025-08-29T11:20:48.738092Z"
1370,"1","2025-08-29T11:20:50.476949Z","sms-00447","ham",1.523,"Sorry, my battery died, I can come by but I'm only getting a gram for now, where's your place?","2025-08-29T11:20:50.476966Z"
1371,"1","2025-08-29T11:20:52.076906Z","sms-00448","ham",1.399,"Well done, blimey, exercise, yeah, i kinda remember wot that is, hmm. ","2025-08-29T11:20:52.076924Z"
1372,"1","2025-08-29T11:20:53.607673Z","sms-00449","ham",1.32,"I wont get concentration dear you know you are my mind and everything :-)","2025-08-29T11:20:53.607695Z"
1373,"1","2025-08-29T11:20:55.302357Z","sms-00450","ham",1.439,"LOL ... Have you made plans for new years?","2025-08-29T11:20:55.302376Z"
1374,"1","2025-08-29T11:21:00.551176Z","sms-00451","ham",5.035,"10 min later k...","2025-08-29T11:21:00.551197Z"
1375,"1","2025-08-29T11:21:01.687228Z","sms-00452","ham",0.917,"hanks lotsly!","2025-08-29T11:21:01.687247Z"
1376,"1","2025-08-29T11:21:06.660654Z","sms-00453","ham",4.733,"Thanks for this hope you had a good day today","2025-08-29T11:21:06.660667Z"
1377,"1","2025-08-29T11:21:08.032946Z","sms-00454","ham",1.129,"K:)k:)what are detail you want to transfer?acc no enough?","2025-08-29T11:21:08.032969Z"
1378,"1","2025-08-29T11:21:09.213024Z","sms-00455","ham",0.955,"Ok i will tell her to stay out. Yeah its been tough but we are optimistic things will improve this month.","2025-08-29T11:21:09.213037Z"
1379,"1","2025-08-29T11:21:10.834894Z","sms-00456","spam",1.408,"Loan for any purpose £500 - £75,000. Homeowners + Tenants welcome. Have you been previously refused? We can still help. Call Free 0800 1956669 or text back 'help'","2025-08-29T11:21:10.834909Z"
1380,"1","2025-08-29T11:21:12.025793Z","sms-00457","ham",0.984,"Si si. I think ill go make those oreo truffles.","2025-08-29T11:21:12.025820Z"
1381,"1","2025-08-29T11:21:14.237816Z","sms-00458","ham",2.005,"LOOK AT AMY URE A BEAUTIFUL, INTELLIGENT WOMAN AND I LIKE U A LOT. I KNOW U DONT LIKE ME LIKE THAT SO DONT WORRY.","2025-08-29T11:21:14.237831Z"
1382,"1","2025-08-29T11:21:16.268295Z","sms-00459","ham",1.602,"I hope you that's the result of being consistently intelligent and kind. Start asking him about practicum links and keep your ears open and all the best. ttyl","2025-08-29T11:21:16.268313Z"
1383,"1","2025-08-29T11:21:17.989845Z","sms-00460","ham",1.515,"1.20 that call cost. Which i guess isnt bad. Miss ya, need ya, want ya, love ya","2025-08-29T11:21:17.989862Z"
1384,"1","2025-08-29T11:21:19.418727Z","sms-00461","ham",1.205,"Going thru a very different feeling.wavering decisions and coping up with the same is the same individual.time will heal everything i believe.","2025-08-29T11:21:19.418742Z"
1385,"1","2025-08-29T11:21:20.639115Z","sms-00462","ham",1.011,"Where did u go? My phone is gonna die you have to stay in here","2025-08-29T11:21:20.639133Z"
1386,"1","2025-08-29T11:21:22.038658Z","sms-00463","ham",1.17,"Great. Never been better. Each day gives even more reasons to thank God","2025-08-29T11:21:22.038677Z"
1387,"1","2025-08-29T11:21:24.116613Z","sms-00464","spam",1.869,"UpgrdCentre Orange customer, you may now claim your FREE CAMERA PHONE upgrade for your loyalty. Call now on 0207 153 9153. Offer ends 26th July. T&C's apply. Opt-out available","2025-08-29T11:21:24.116633Z"
1388,"1","2025-08-29T11:21:25.224383Z","sms-00465","ham",0.872,"Sorry, I'll call later ok bye","2025-08-29T11:21:25.224408Z"
1389,"1","2025-08-29T11:21:26.241100Z","sms-00466","ham",0.839,"Ok i am on the way to railway","2025-08-29T11:21:26.241118Z"
1390,"1","2025-08-29T11:21:28.441419Z","sms-00467","ham",1.987,"great princess! I love giving and receiving oral. Doggy style is my fave position. How about you? I enjoy making love  &lt;#&gt;  times per night :)","2025-08-29T11:21:28.441439Z"
1391,"1","2025-08-29T11:21:30.112006Z","sms-00468","ham",1.446,"They don't put that stuff on the roads to keep it from getting slippery over there?","2025-08-29T11:21:30.112023Z"
1392,"1","2025-08-29T11:21:31.140096Z","sms-00469","ham",0.822,"When are you going to ride your bike?","2025-08-29T11:21:31.140114Z"
1393,"1","2025-08-29T11:21:32.122012Z","sms-00470","ham",0.76,"Yup, no need. I'll jus wait 4 e rain 2 stop.","2025-08-29T11:21:32.122035Z"
1394,"1","2025-08-29T11:21:33.020660Z","sms-00471","ham",0.696,"There are many company. Tell me the language.","2025-08-29T11:21:33.020678Z"
1395,"1","2025-08-29T11:21:34.773709Z","sms-00472","spam",1.534,"okmail: Dear Dave this is your final notice to collect your 4* Tenerife Holiday or #5000 CASH award! Call 09061743806 from landline. TCs SAE Box326 CW25WX 150ppm","2025-08-29T11:21:34.773728Z"
1396,"1","2025-08-29T11:21:36.814032Z","sms-00473","ham",1.821,"How long has it been since you screamed, princess?","2025-08-29T11:21:36.814050Z"
1397,"1","2025-08-29T11:21:42.673274Z","sms-00474","ham",5.647,"Nothing. I meant that once the money enters your account here, the bank will remove its flat rate. Someone transfered  &lt;#&gt;  to my account and  &lt;#&gt; dollars got removed. So the banks differ and charges also differ.be sure you trust the 9ja person you are sending account details to cos...","2025-08-29T11:21:42.673291Z"
1398,"1","2025-08-29T11:21:45.638858Z","sms-00475","spam",2.742,"Want 2 get laid tonight? Want real Dogging locations sent direct 2 ur Mob? Join the UK's largest Dogging Network by txting MOAN to 69888Nyt. ec2a. 31p.msg@150p","2025-08-29T11:21:45.638877Z"
1399,"1","2025-08-29T11:21:48.157274Z","sms-00476","ham",2.287,"Nice line said by a broken heart- Plz don't cum 1 more times infront of me... Other wise once again I ll trust U... Good 9t:)","2025-08-29T11:21:48.157288Z"
1400,"1","2025-08-29T11:21:49.307026Z","sms-00477","ham",0.924,"Ok I'm gonna head up to usf in like fifteen minutes","2025-08-29T11:21:49.307044Z"
1401,"1","2025-08-29T11:21:50.218648Z","sms-00478","ham",0.702,"Love you aathi..love u lot..","2025-08-29T11:21:50.218675Z"
1402,"1","2025-08-29T11:21:51.122917Z","sms-00479","ham",0.695,"Tension ah?what machi?any problem?","2025-08-29T11:21:51.122935Z"
1403,"1","2025-08-29T11:21:52.063326Z","sms-00480","ham",0.733,"K, can I pick up another 8th when you're done?","2025-08-29T11:21:52.063344Z"
1404,"1","2025-08-29T11:21:53.278186Z","sms-00481","ham",0.946,"When're you guys getting back? G said you were thinking about not staying for mcr","2025-08-29T11:21:53.278206Z"
1405,"1","2025-08-29T11:21:54.265982Z","sms-00482","ham",0.769,"Almost there, see u in a sec","2025-08-29T11:21:54.266003Z"
1406,"1","2025-08-29T11:21:55.428300Z","sms-00483","ham",0.934,"Yo carlos, a few friends are already asking me about you, you working at all this weekend?","2025-08-29T11:21:55.428319Z"
1407,"1","2025-08-29T11:21:56.687072Z","sms-00484","ham",0.995,"Watching tv lor...","2025-08-29T11:21:56.687091Z"
1408,"1","2025-08-29T11:21:57.681726Z","sms-00485","ham",0.78,"Thank you baby! I cant wait to taste the real thing...","2025-08-29T11:21:57.681740Z"
1409,"1","2025-08-29T11:21:58.881554Z","sms-00486","ham",1.0,"You should change your fb to jaykwon thuglyfe falconerf","2025-08-29T11:21:58.881568Z"
1410,"1","2025-08-29T11:22:00.450399Z","sms-00487","ham",1.349,"If we win its really no 1 side for long time.","2025-08-29T11:22:00.450415Z"
1411,"1","2025-08-29T11:22:01.955876Z","sms-00488","spam",1.278,"FREE MESSAGE Activate your 500 FREE Text Messages by replying to this message with the word FREE For terms & conditions, visit www.07781482378.com","2025-08-29T11:22:01.955896Z"
1412,"1","2025-08-29T11:22:03.324316Z","sms-00489","ham",1.149,"Dear reached railway. What happen to you","2025-08-29T11:22:03.324329Z"
1413,"1","2025-08-29T11:22:05.088385Z","sms-00490","ham",1.544,"Depends on quality. If you want the type i sent boye, faded glory, then about 6. If you want ralphs maybe 2","2025-08-29T11:22:05.088403Z"
1414,"1","2025-08-29T11:22:06.219224Z","sms-00491","ham",0.912,"I think i've fixed it can you send a test message?","2025-08-29T11:22:06.219236Z"
1415,"1","2025-08-29T11:22:08.874731Z","sms-00492","ham",2.448,"Sorry man my account's dry or I would, if you want we could trade back half or I could buy some shit with my credit card","2025-08-29T11:22:08.874752Z"
1416,"1","2025-08-29T11:22:10.447487Z","sms-00493","spam",1.353,"Congrats! 1 year special cinema pass for 2 is yours. call 09061209465 now! C Suprman V, Matrix3, StarWars3, etc all 4 FREE! bx420-ip4-5we. 150pm. Dont miss out!","2025-08-29T11:22:10.447507Z"
1417,"1","2025-08-29T11:22:11.430463Z","sms-00494","ham",0.759,"Sorry,in meeting I'll call later","2025-08-29T11:22:11.430479Z"
1418,"1","2025-08-29T11:22:12.349479Z","sms-00495","ham",0.701,"What class of  &lt;#&gt;  reunion?","2025-08-29T11:22:12.349495Z"
1419,"1","2025-08-29T11:22:13.208198Z","sms-00496","ham",0.625,"Are you free now?can i call now?","2025-08-29T11:22:13.208221Z"
1420,"1","2025-08-29T11:22:14.106305Z","sms-00497","ham",0.681,"Got meh... When?","2025-08-29T11:22:14.106323Z"
1421,"1","2025-08-29T11:22:15.073300Z","sms-00498","ham",0.738,"Nope... Think i will go for it on monday... Sorry i replied so late","2025-08-29T11:22:15.073314Z"
1422,"1","2025-08-29T11:22:16.118372Z","sms-00499","ham",0.817,"Some of them told accenture is not confirm. Is it true.","2025-08-29T11:22:16.118389Z"
1423,"1","2025-08-29T11:22:17.163961Z","sms-00500","ham",0.808,"Kate jackson rec center before 7ish, right?","2025-08-29T11:22:17.163979Z"
1424,"1","2025-08-29T11:22:18.032971Z","sms-00501","ham",0.649,"Dear i have reache room","2025-08-29T11:22:18.032991Z"
1425,"1","2025-08-29T11:22:20.952896Z","sms-00502","ham",2.707,"Fighting with the world is easy, u either win or lose bt fightng with some1 who is close to u is dificult if u lose - u lose if u win - u still lose.","2025-08-29T11:22:20.952913Z"
1426,"1","2025-08-29T11:22:22.433037Z","sms-00503","ham",1.198,"When can ü come out?","2025-08-29T11:22:22.433051Z"
1427,"1","2025-08-29T11:22:23.863198Z","sms-00504","ham",1.183,"Check with nuerologist.","2025-08-29T11:22:23.863214Z"
1428,"1","2025-08-29T11:22:24.796016Z","sms-00505","ham",0.722,"Lolnice. I went from a fish to ..water.?","2025-08-29T11:22:24.796030Z"
1429,"1","2025-08-29T11:22:26.624751Z","sms-00506","spam",1.618,"+123 Congratulations - in this week's competition draw u have won the £1450 prize to claim just call 09050002311 b4280703. T&Cs/stop SMS 08718727868. Over 18 only 150ppm","2025-08-29T11:22:26.624768Z"
1430,"1","2025-08-29T11:22:29.374589Z","sms-00507","ham",2.521,"No it's waiting in e car dat's bored wat. Cos wait outside got nothing 2 do. At home can do my stuff or watch tv wat.","2025-08-29T11:22:29.374607Z"
1431,"1","2025-08-29T11:22:30.971945Z","sms-00508","ham",1.367,"Maybe westshore or hyde park village, the place near my house?","2025-08-29T11:22:30.971959Z"
1432,"1","2025-08-29T11:22:33.478846Z","sms-00509","ham",2.286,"You should know now. So how's anthony. Are you bringing money. I've school fees to pay and rent and stuff like that. Thats why i need your help. A friend in need....|","2025-08-29T11:22:33.478861Z"
1433,"1","2025-08-29T11:22:34.592197Z","sms-00510","ham",0.884,"What's the significance?","2025-08-29T11:22:34.592212Z"
1434,"1","2025-08-29T11:22:36.369859Z","sms-00511","ham",1.497,"Your opinion about me? 1. Over 2. Jada 3. Kusruthi 4. Lovable 5. Silent 6. Spl character 7. Not matured 8. Stylish 9. Simple Pls reply..","2025-08-29T11:22:36.369869Z"
1435,"1","2025-08-29T11:22:38.354265Z","sms-00512","ham",1.783,"8 at the latest, g's still there if you can scrounge up some ammo and want to give the new ak a try","2025-08-29T11:22:38.354281Z"
1436,"1","2025-08-29T11:22:42.192265Z","sms-00513","ham",3.616,"Prabha..i'm soryda..realy..frm heart i'm sory","2025-08-29T11:22:42.192281Z"
1437,"1","2025-08-29T11:22:43.426095Z","sms-00514","ham",1.002,"Lol ok your forgiven :)","2025-08-29T11:22:43.426115Z"
1438,"1","2025-08-29T11:22:44.462455Z","sms-00515","ham",0.811,"No..jst change tat only..","2025-08-29T11:22:44.462473Z"
1439,"1","2025-08-29T11:22:46.462988Z","sms-00516","spam",1.788,"You are guaranteed the latest Nokia Phone, a 40GB iPod MP3 player or a £500 prize! Txt word: COLLECT to No: 83355! IBHltd LdnW15H 150p/Mtmsgrcvd18+","2025-08-29T11:22:46.463003Z"
1440,"1","2025-08-29T11:22:47.471723Z","sms-00517","ham",0.793,"S:)no competition for him.","2025-08-29T11:22:47.471739Z"
1441,"1","2025-08-29T11:22:48.989529Z","sms-00518","spam",1.3,"Boltblue tones for 150p Reply POLY# or MONO# eg POLY3 1. Cha Cha Slide 2. Yeah 3. Slow Jamz 6. Toxic 8. Come With Me or STOP 4 more tones txt MORE","2025-08-29T11:22:48.989550Z"
1442,"1","2025-08-29T11:22:50.654132Z","sms-00519","spam",1.435,"Your credits have been topped up for http://www.bubbletext.com Your renewal Pin is tgxxrz","2025-08-29T11:22:50.654152Z"
1443,"1","2025-08-29T11:22:54.672063Z","sms-00520","ham",3.766,"That way transport is less problematic than on sat night. By the way, if u want to ask  n  to join my bday, feel free. But need to know definite nos as booking on fri. ","2025-08-29T11:22:54.672079Z"
1444,"1","2025-08-29T11:22:57.286023Z","sms-00521","ham",2.38,"Usually the person is unconscious that's in children but in adults they may just behave abnormally. I.ll call you now","2025-08-29T11:22:57.286040Z"
1445,"1","2025-08-29T11:23:00.058195Z","sms-00522","ham",2.526,"But that's on ebay it might be less elsewhere.","2025-08-29T11:23:00.058215Z"
1446,"1","2025-08-29T11:23:01.407324Z","sms-00523","ham",1.129,"Shall i come to get pickle","2025-08-29T11:23:01.407342Z"
1447,"1","2025-08-29T11:23:03.085365Z","sms-00524","ham",1.449,"Were gonna go get some tacos","2025-08-29T11:23:03.085384Z"
1448,"1","2025-08-29T11:23:04.760740Z","sms-00525","ham",1.426,"That's very rude, you on campus?","2025-08-29T11:23:04.760759Z"
1449,"1","2025-08-29T11:23:06.213558Z","sms-00526","spam",1.222,"URGENT!: Your Mobile No. was awarded a £2,000 Bonus Caller Prize on 02/09/03! This is our 2nd attempt to contact YOU! Call 0871-872-9755 BOX95QU","2025-08-29T11:23:06.213574Z"
1450,"1","2025-08-29T11:23:07.248027Z","sms-00527","ham",0.802,"Hi i won't b ard 4 christmas. But do enjoy n merry x'mas.","2025-08-29T11:23:07.248043Z"
1451,"1","2025-08-29T11:23:08.644187Z","sms-00528","spam",1.16,"Today's Offer! Claim ur £150 worth of discount vouchers! Text YES to 85023 now! SavaMob, member offers mobile! T Cs 08717898035. £3.00 Sub. 16 . Unsub reply X","2025-08-29T11:23:08.644207Z"
1452,"1","2025-08-29T11:23:09.677335Z","sms-00529","ham",0.795,"Yes! How is a pretty lady like you single?","2025-08-29T11:23:09.677353Z"
1453,"1","2025-08-29T11:23:14.105233Z","sms-00530","spam",4.199,"You will recieve your tone within the next 24hrs. For Terms and conditions please see Channel U Teletext Pg 750","2025-08-29T11:23:14.105250Z"
1454,"1","2025-08-29T11:23:15.218038Z","sms-00531","ham",0.888,"Jay says that you're a double-faggot","2025-08-29T11:23:15.218054Z"
1455,"1","2025-08-29T11:23:17.083818Z","sms-00532","spam",1.638,"PRIVATE! Your 2003 Account Statement for 07815296484 shows 800 un-redeemed S.I.M. points. Call 08718738001 Identifier Code 41782 Expires 18/11/04 ","2025-08-29T11:23:17.083834Z"
1456,"1","2025-08-29T11:23:18.164539Z","sms-00533","ham",0.849,"What Today-sunday..sunday is holiday..so no work..","2025-08-29T11:23:18.164558Z"
1457,"1","2025-08-29T11:23:19.178650Z","sms-00534","ham",0.786,"Gudnite....tc...practice going on","2025-08-29T11:23:19.178667Z"
1458,"1","2025-08-29T11:23:20.195930Z","sms-00535","ham",0.792,"I'll be late...","2025-08-29T11:23:20.195952Z"
1459,"1","2025-08-29T11:23:22.747442Z","sms-00536","ham",2.326,"I've not called you in a while. This is hoping it was l8r malaria and that you know that we miss you guys. I miss Bani big, so pls give her my love especially. Have a great day.","2025-08-29T11:23:22.747458Z"
1460,"1","2025-08-29T11:23:24.697094Z","sms-00537","ham",1.712,"Good afternoon, my love! How goes that day ? I hope maybe you got some leads on a job. I think of you, boytoy and send you a passionate kiss from across the sea","2025-08-29T11:23:24.697111Z"
1461,"1","2025-08-29T11:23:25.918600Z","sms-00538","ham",0.996,"Probably gonna be here for a while, see you later tonight &lt;)","2025-08-29T11:23:25.918618Z"
1462,"1","2025-08-29T11:23:27.206375Z","sms-00539","ham",1.065,"Or maybe my fat fingers just press all these buttons and it doesn't know what to do.","2025-08-29T11:23:27.206396Z"
1463,"1","2025-08-29T11:23:28.633102Z","sms-00540","ham",1.188,"Ummmmmaah Many many happy returns of d day my dear sweet heart.. HAPPY BIRTHDAY dear","2025-08-29T11:23:28.633123Z"
1464,"1","2025-08-29T11:23:29.878740Z","sms-00541","ham",1.014,"I am in tirupur da, once you started from office call me.","2025-08-29T11:23:29.878757Z"
1465,"1","2025-08-29T11:23:32.942307Z","sms-00542","spam",2.834,"from www.Applausestore.com MonthlySubscription@50p/msg max6/month T&CsC web age16 2stop txt stop","2025-08-29T11:23:32.942325Z"
1466,"1","2025-08-29T11:23:37.157165Z","sms-00543","ham",3.966,"A famous quote : when you develop the ability to listen to 'anything' unconditionally without losing your temper or self confidence, it means you are ......... 'MARRIED'","2025-08-29T11:23:37.157185Z"
1467,"1","2025-08-29T11:23:38.920694Z","sms-00544","ham",1.523,"But am going to college pa. What to do. are else ill come there it self. Pa.","2025-08-29T11:23:38.920713Z"
1468,"1","2025-08-29T11:23:40.232715Z","sms-00545","ham",1.022,"4 oclock at mine. Just to bash out a flat plan.","2025-08-29T11:23:40.232733Z"
1469,"1","2025-08-29T11:23:41.702472Z","sms-00546","ham",1.231,"This girl does not stay in bed. This girl doesn't need recovery time. Id rather pass out while having fun then be cooped up in bed","2025-08-29T11:23:41.702490Z"
1470,"1","2025-08-29T11:23:43.044045Z","sms-00547","ham",1.113,"Then any special there?","2025-08-29T11:23:43.044062Z"
1471,"1","2025-08-29T11:23:44.761230Z","sms-00548","ham",1.482,"I know but you need to get hotel now. I just got my invitation but i had to apologise. Cali is to sweet for me to come to some english bloke's weddin","2025-08-29T11:23:44.761249Z"
1472,"1","2025-08-29T11:23:45.741836Z","sms-00549","ham",0.749,"Sorry that took so long, omw now","2025-08-29T11:23:45.741853Z"
1473,"1","2025-08-29T11:23:46.640271Z","sms-00550","ham",0.663,"Wait  &lt;#&gt;  min..","2025-08-29T11:23:46.640292Z"
1474,"1","2025-08-29T11:23:48.470933Z","sms-00551","ham",1.601,"Ok give me 5 minutes I think I see her. BTW you're my alibi. You were cutting my hair the whole time.","2025-08-29T11:23:48.470952Z"
1475,"1","2025-08-29T11:23:52.728242Z","sms-00552","ham",3.996,"Imagine you finally get to sink into that bath after I have put you through your paces, maybe even having you eat me for a while before I left ... But also imagine the feel of that cage on your cock surrounded by the bath water, reminding you always who owns you ... Enjoy, my cuck","2025-08-29T11:23:52.728257Z"
1476,"1","2025-08-29T11:23:53.827009Z","sms-00553","ham",0.86,"Hurry up, I've been weed-deficient for like three days","2025-08-29T11:23:53.827026Z"
1477,"1","2025-08-29T11:23:54.972800Z","sms-00554","ham",0.852,"Sure, if I get an acknowledgement from you that it's astoundingly tactless and generally faggy to demand a blood oath fo","2025-08-29T11:23:54.972824Z"
1478,"1","2025-08-29T11:23:57.827784Z","sms-00555","ham",2.609,"Ok. Every night take a warm bath drink a cup of milk and you'll see a work of magic. You still need to loose weight. Just so that you know","2025-08-29T11:23:57.827799Z"
1479,"1","2025-08-29T11:23:59.174747Z","sms-00556","ham",1.101,"I‘ll have a look at the frying pan in case it‘s cheap or a book perhaps. No that‘s silly a frying pan isn‘t likely to be a book","2025-08-29T11:23:59.174765Z"
1480,"1","2025-08-29T11:24:00.509012Z","sms-00557","ham",1.096,"O. Well uv causes mutations. Sunscreen is like essential thesedays","2025-08-29T11:24:00.509028Z"
1481,"1","2025-08-29T11:24:01.417820Z","sms-00558","ham",0.688,"Having lunch:)you are not in online?why?","2025-08-29T11:24:01.417839Z"
1482,"1","2025-08-29T11:24:02.315798Z","sms-00559","ham",0.655,"I know that my friend already told that.","2025-08-29T11:24:02.315814Z"
1483,"1","2025-08-29T11:24:03.192629Z","sms-00560","ham",0.654,"Hi Princess! Thank you for the pics. You are very pretty. How are you?","2025-08-29T11:24:03.192646Z"
1484,"1","2025-08-29T11:24:04.977659Z","sms-00561","ham",1.554,"Aiyo... U always c our ex one... I dunno abt mei, she haven reply... First time u reply so fast... Y so lucky not workin huh, got bao by ur sugardad ah...gee.. ","2025-08-29T11:24:04.977676Z"
1485,"1","2025-08-29T11:24:06.023658Z","sms-00562","ham",0.794,"Hi msg me:)i'm in office..","2025-08-29T11:24:06.023674Z"
1486,"1","2025-08-29T11:24:06.946542Z","sms-00563","ham",0.677,"Thanx 4 e brownie it's v nice...","2025-08-29T11:24:06.946558Z"
1487,"1","2025-08-29T11:24:07.821556Z","sms-00564","ham",0.64,"Geeeee ... I love you so much I can barely stand it","2025-08-29T11:24:07.821576Z"
1488,"1","2025-08-29T11:24:09.660268Z","sms-00565","spam",1.603,"GENT! We are trying to contact you. Last weekends draw shows that you won a £1000 prize GUARANTEED. Call 09064012160. Claim Code K52. Valid 12hrs only. 150ppm ","2025-08-29T11:24:09.660286Z"
1489,"1","2025-08-29T11:24:10.798783Z","sms-00566","ham",0.895,"Fuck babe ... I miss you already, you know ? Can't you let me send you some money towards your net ? I need you ... I want you ... I crave you ...","2025-08-29T11:24:10.798804Z"
1490,"1","2025-08-29T11:24:12.274228Z","sms-00567","ham",1.233,"Ill call u 2mrw at ninish, with my address that icky American freek wont stop callin me 2 bad Jen k eh?","2025-08-29T11:24:12.274249Z"
1491,"1","2025-08-29T11:24:13.202811Z","sms-00568","ham",0.696,"Oooh bed ridden ey? What are YOU thinking of?","2025-08-29T11:24:13.202831Z"
1492,"1","2025-08-29T11:24:14.892825Z","sms-00569","ham",1.462,"So anyways, you can just go to your gym or whatever, my love *smiles* I hope your ok and having a good day babe ... I miss you so much already","2025-08-29T11:24:14.892844Z"
1493,"1","2025-08-29T11:24:16.126722Z","sms-00570","ham",0.997,"Love it! Daddy will make you scream with pleasure! I am going to slap your ass with my dick!","2025-08-29T11:24:16.126738Z"
1494,"1","2025-08-29T11:24:17.221510Z","sms-00571","ham",0.854,"WOT U WANNA DO THEN MISSY?","2025-08-29T11:24:17.221528Z"
1495,"1","2025-08-29T11:24:19.256155Z","sms-00572","ham",1.787,"Yar lor wait 4 my mum 2 finish sch then have lunch lor... I whole morning stay at home clean my room now my room quite clean... Hee...","2025-08-29T11:24:19.256173Z"
1496,"1","2025-08-29T11:24:20.178659Z","sms-00573","ham",0.694,"Do you know where my lab goggles went","2025-08-29T11:24:20.178678Z"
1497,"1","2025-08-29T11:24:21.119119Z","sms-00574","ham",0.7,"Can you open the door?","2025-08-29T11:24:21.119142Z"
1498,"1","2025-08-29T11:24:22.008509Z","sms-00575","ham",0.645,"Waiting for your call.","2025-08-29T11:24:22.008528Z"
1499,"1","2025-08-29T11:24:22.829312Z","sms-00576","ham",0.592,"Nope i waiting in sch 4 daddy... ","2025-08-29T11:24:22.829332Z"
