"annotation_id","annotator","created_at","id","label","lead_time","text","updated_at"
1500,"1","2025-08-29T11:24:24.741026Z","sms-00577","spam",1.673,"You have won ?1,000 cash or a ?2,000 prize! To claim, call09050000327","2025-08-29T11:24:24.741044Z"
1501,"1","2025-08-29T11:24:25.771527Z","sms-00578","ham",0.803,"I'm tired of arguing with you about this week after week. Do what you want and from now on, i'll do the same.","2025-08-29T11:24:25.771546Z"
1502,"1","2025-08-29T11:24:26.779256Z","sms-00579","ham",0.771,"Ü wait 4 me in sch i finish ard 5..","2025-08-29T11:24:26.779274Z"
1503,"1","2025-08-29T11:24:31.686972Z","sms-00580","spam",4.657,"our mobile number has won £5000, to claim calls us back or ring the claims hot line on 09050005321.","2025-08-29T11:24:31.686990Z"
1504,"1","2025-08-29T11:24:34.522372Z","sms-00581","ham",2.579,"Arngd marriage is while u r walkin unfortuntly a snake bites u. bt love marriage is dancing in frnt of d snake &amp; sayin Bite me, bite me.","2025-08-29T11:24:34.522392Z"
1505,"1","2025-08-29T11:24:35.648871Z","sms-00582","ham",0.877,"Huh so early.. Then ü having dinner outside izzit?","2025-08-29T11:24:35.648889Z"
1506,"1","2025-08-29T11:24:36.624821Z","sms-00583","ham",0.748,"Ok anyway no need to change with what you said","2025-08-29T11:24:36.624830Z"
1507,"1","2025-08-29T11:24:38.534725Z","sms-00584","spam",1.68,"We tried to contact you re your reply to our offer of 750 mins 150 textand a new video phone call 08002988890 now or reply for free delivery tomorrow","2025-08-29T11:24:38.534734Z"
1508,"1","2025-08-29T11:24:39.541493Z","sms-00585","ham",0.748,"my ex-wife was not able to have kids. Do you want kids one day?","2025-08-29T11:24:39.541509Z"
1509,"1","2025-08-29T11:24:42.370436Z","sms-00586","ham",2.583,"So how's scotland. Hope you are not over showing your JJC tendencies. Take care. Live the dream","2025-08-29T11:24:42.370454Z"
1510,"1","2025-08-29T11:24:44.007914Z","sms-00587","ham",1.391,"Tell them u have a headache and just want to use 1 hour of sick time.","2025-08-29T11:24:44.007932Z"
1511,"1","2025-08-29T11:24:45.671941Z","sms-00588","ham",1.431,"I dun thk i'll quit yet... Hmmm, can go jazz ? Yogasana oso can... We can go meet em after our lessons den... ","2025-08-29T11:24:45.671957Z"
1512,"1","2025-08-29T11:24:47.060971Z","sms-00589","ham",1.131,"""Pete can you please ring meive hardly gotany credit""","2025-08-29T11:24:47.060978Z"
1513,"1","2025-08-29T11:24:48.150486Z","sms-00590","ham",0.88,"Ya srsly better than yi tho","2025-08-29T11:24:48.150503Z"
1514,"1","2025-08-29T11:24:49.070366Z","sms-00591","ham",0.662,"I'm in a meeting, call me later at","2025-08-29T11:24:49.070386Z"
1515,"1","2025-08-29T11:24:50.603254Z","sms-00592","spam",1.288,"For ur chance to win a £250 wkly shopping spree TXT: SHOP to 80878. T's&C's www.txt-2-shop.com custcare 08715705022, 1x150p/wk","2025-08-29T11:24:50.603271Z"
1516,"1","2025-08-29T11:24:52.223114Z","sms-00593","spam",1.375,"You have been specially selected to receive a 2000 pound award! Call 08712402050 BEFORE the lines close. Cost 10ppm. 16+. T&Cs apply. AG Promo","2025-08-29T11:24:52.223134Z"
1517,"1","2025-08-29T11:24:54.003427Z","sms-00594","spam",1.532,"PRIVATE! Your 2003 Account Statement for 07753741225 shows 800 un-redeemed S. I. M. points. Call 08715203677 Identifier Code: 42478 Expires 24/10/04","2025-08-29T11:24:54.003442Z"
1518,"1","2025-08-29T11:24:55.218182Z","sms-00595","ham",0.972,"You still at grand prix?","2025-08-29T11:24:55.218204Z"
1519,"1","2025-08-29T11:24:57.001445Z","sms-00596","ham",1.534,"I met you as a stranger and choose you as my friend. As long as the world stands, our friendship never ends. Lets be Friends forever!!! Gud nitz...","2025-08-29T11:24:57.001464Z"
1520,"1","2025-08-29T11:24:58.259248Z","sms-00597","ham",1.001,"I am great! How are you?","2025-08-29T11:24:58.259270Z"
1521,"1","2025-08-29T11:25:00.442258Z","sms-00598","ham",1.935,"Gud mrng dear have a nice day","2025-08-29T11:25:00.442275Z"
1522,"1","2025-08-29T11:25:02.219021Z","sms-00599","spam",1.527,"You have an important customer service announcement. Call FREEPHONE 0800 542 0825 now!","2025-08-29T11:25:02.219064Z"
1523,"1","2025-08-29T11:25:03.275228Z","sms-00600","ham",0.816,"Will do. Was exhausted on train this morning. Too much wine and pie. You sleep well too","2025-08-29T11:25:03.275244Z"
1524,"1","2025-08-29T11:25:04.343021Z","sms-00601","ham",0.821,"I'm going out to buy mum's present ar.","2025-08-29T11:25:04.343041Z"
1525,"1","2025-08-29T11:25:05.893647Z","sms-00602","ham",1.296,"Mind blastin.. No more Tsunamis will occur from now on.. Rajnikant stopped swimming in Indian Ocean..:-D","2025-08-29T11:25:05.893664Z"
1526,"1","2025-08-29T11:25:07.035073Z","sms-00603","ham",0.904,"If u sending her home first it's ok lor. I'm not ready yet.","2025-08-29T11:25:07.035088Z"
1527,"1","2025-08-29T11:25:08.685134Z","sms-00604","ham",1.405,"Speaking of does he have any cash yet?","2025-08-29T11:25:08.685152Z"
1528,"1","2025-08-29T11:25:09.921504Z","sms-00605","ham",0.997,"Be happy there. I will come after noon","2025-08-29T11:25:09.921523Z"
1529,"1","2025-08-29T11:25:10.933841Z","sms-00606","ham",0.754,"Meet after lunch la...","2025-08-29T11:25:10.933859Z"
1530,"1","2025-08-29T11:25:12.170333Z","sms-00607","ham",0.989,"TaKe CaRE n gET WeLL sOOn","2025-08-29T11:25:12.170355Z"
1531,"1","2025-08-29T11:25:13.777464Z","sms-00608","spam",1.359,"XCLUSIVE@CLUBSAISAI 2MOROW 28/5 SOIREE SPECIALE ZOUK WITH NICHOLS FROM PARIS.FREE ROSES 2 ALL LADIES !!! info: 07946746291/07880867867 ","2025-08-29T11:25:13.777481Z"
1532,"1","2025-08-29T11:25:14.946061Z","sms-00609","ham",0.922,"what I meant to say is cant wait to see u again getting bored of this bridgwater banter","2025-08-29T11:25:14.946075Z"
1533,"1","2025-08-29T11:25:16.005581Z","sms-00610","ham",0.813,"Neva mind it's ok..","2025-08-29T11:25:16.005601Z"
1534,"1","2025-08-29T11:25:17.181986Z","sms-00611","ham",0.907,"It's fine, imma get a drink or somethin. Want me to come find you?","2025-08-29T11:25:17.182009Z"
1535,"1","2025-08-29T11:25:19.799460Z","sms-00612","spam",2.356,"22 days to kick off! For Euro2004 U will be kept up to date with the latest news and results daily. To be removed send GET TXT STOP to 83222","2025-08-29T11:25:19.799474Z"
1536,"1","2025-08-29T11:25:21.597992Z","sms-00613","ham",1.545,"Its a valentine game. . . Send dis msg to all ur friends. .. If 5 answers r d same then someone really loves u. Ques- which colour suits me the best?rply me","2025-08-29T11:25:21.598011Z"
1537,"1","2025-08-29T11:25:22.645532Z","sms-00614","ham",0.8,"I have many dependents","2025-08-29T11:25:22.645551Z"
1538,"1","2025-08-29T11:25:26.048594Z","sms-00615","ham",3.155,"THANX4 TODAY CER IT WAS NICE 2 CATCH UP BUT WE AVE 2 FIND MORE TIME MORE OFTEN OH WELL TAKE CARE C U SOON.C","2025-08-29T11:25:26.048615Z"
1539,"1","2025-08-29T11:25:27.211268Z","sms-00616","ham",0.91,"I called and said all to him:)then he have to choose this future.","2025-08-29T11:25:27.211288Z"
1540,"1","2025-08-29T11:25:28.589471Z","sms-00617","ham",1.111,"""Happy valentines day"" I know its early but i have hundreds of handsomes and beauties to wish. So i thought to finish off aunties and uncles 1st...","2025-08-29T11:25:28.589493Z"
1541,"1","2025-08-29T11:25:43.260894Z","sms-00618","ham",3.63,"He like not v shock leh. Cos telling shuhui is like telling leona also. Like dat almost all know liao. He got ask me abt ur reaction lor.","2025-08-29T11:25:43.260913Z"
1542,"1","2025-08-29T11:25:44.281580Z","sms-00619","ham",0.776,"For my family happiness..","2025-08-29T11:25:44.281596Z"
1543,"1","2025-08-29T11:25:45.289579Z","sms-00620","ham",0.744,"I come n pick ü up... Come out immediately aft ur lesson...","2025-08-29T11:25:45.289596Z"
1544,"1","2025-08-29T11:25:46.438019Z","sms-00621","ham",0.901,"Let there be snow. Let there be snow. This kind of weather brings ppl together so friendships can grow.","2025-08-29T11:25:46.438041Z"
1545,"1","2025-08-29T11:25:47.381800Z","sms-00622","ham",0.703,"Dear we got  &lt;#&gt;  dollars hi hi","2025-08-29T11:25:47.381823Z"
1546,"1","2025-08-29T11:25:48.341711Z","sms-00623","ham",0.717,"Good words.... But words may leave u in dismay many times.","2025-08-29T11:25:48.341726Z"
1547,"1","2025-08-29T11:25:49.925085Z","sms-00624","ham",1.341,"MAKE SURE ALEX KNOWS HIS BIRTHDAY IS OVER IN FIFTEEN MINUTES AS FAR AS YOU'RE CONCERNED","2025-08-29T11:25:49.925101Z"
1548,"1","2025-08-29T11:25:50.941888Z","sms-00625","ham",0.78,"sorry, no, have got few things to do. may be in pub later.","2025-08-29T11:25:50.941904Z"
1549,"1","2025-08-29T11:25:51.946231Z","sms-00626","ham",0.762,"Nah it's straight, if you can just bring bud or drinks or something that's actually a little more useful than straight cash","2025-08-29T11:25:51.946252Z"
1550,"1","2025-08-29T11:25:52.935059Z","sms-00627","ham",0.737,"Haha good to hear, I'm officially paid and on the market for an 8th","2025-08-29T11:25:52.935080Z"
1551,"1","2025-08-29T11:25:53.835889Z","sms-00628","ham",0.655,"How many licks does it take to get to the center of a tootsie pop?","2025-08-29T11:25:53.835903Z"
1552,"1","2025-08-29T11:25:54.784840Z","sms-00629","ham",0.704,"Yup i thk they r e teacher said that will make my face look longer. Darren ask me not 2 cut too short.","2025-08-29T11:25:54.784862Z"
1553,"1","2025-08-29T11:25:56.876173Z","sms-00630","spam",1.853,"New TEXTBUDDY Chat 2 horny guys in ur area 4 just 25p Free 2 receive Search postcode or at gaytextbuddy.com. TXT ONE name to 89693","2025-08-29T11:25:56.876190Z"
1554,"1","2025-08-29T11:25:58.329027Z","sms-00631","spam",1.187,"Todays Vodafone numbers ending with 4882 are selected to a receive a £350 award. If your number matches call 09064019014 to receive your £350 award.","2025-08-29T11:25:58.329044Z"
1555,"1","2025-08-29T11:25:59.626969Z","sms-00632","ham",1.034,"Please dont say like that. Hi hi hi","2025-08-29T11:25:59.627003Z"
1556,"1","2025-08-29T11:26:00.901736Z","sms-00633","ham",1.025,"Thank u!","2025-08-29T11:26:00.901756Z"
1557,"1","2025-08-29T11:26:02.457752Z","sms-00634","ham",1.316,"Oh that was a forwarded message. I thought you send that to me","2025-08-29T11:26:02.457768Z"
1558,"1","2025-08-29T11:26:03.653765Z","sms-00635","ham",0.937,"Got it. Seventeen pounds for seven hundred ml – hope ok.","2025-08-29T11:26:03.653782Z"
1559,"1","2025-08-29T11:26:05.027966Z","sms-00636","spam",1.12,"Dear Voucher Holder, 2 claim this weeks offer, at your PC go to http://www.e-tlp.co.uk/expressoffer Ts&Cs apply.2 stop texts txt STOP to 80062.","2025-08-29T11:26:05.027988Z"
1560,"1","2025-08-29T11:26:06.310709Z","sms-00637","ham",1.033,"Me n him so funny...","2025-08-29T11:26:06.310725Z"
1561,"1","2025-08-29T11:26:08.147674Z","sms-00638","ham",1.587,"Sweetheart, hope you are not having that kind of day! Have one with loads of reasons to smile. Biola","2025-08-29T11:26:08.147691Z"
1562,"1","2025-08-29T11:26:09.197171Z","sms-00639","ham",0.782,"When ü login dat time... Dad fetching ü home now?","2025-08-29T11:26:09.197187Z"
1563,"1","2025-08-29T11:26:10.173915Z","sms-00640","ham",0.725,"What will we do in the shower, baby?","2025-08-29T11:26:10.173932Z"
1564,"1","2025-08-29T11:26:11.120488Z","sms-00641","ham",0.696,"I had askd u a question some hours before. Its answer","2025-08-29T11:26:11.120504Z"
1565,"1","2025-08-29T11:26:12.310711Z","sms-00642","ham",0.938,"Well imma definitely need to restock before thanksgiving, I'll let you know when I'm out","2025-08-29T11:26:12.310733Z"
1566,"1","2025-08-29T11:26:16.345978Z","sms-00643","ham",3.774," said kiss, kiss, i can't do the sound effects! He is a gorgeous man isn't he! Kind of person who needs a smile to brighten his day! ","2025-08-29T11:26:16.345993Z"
1567,"1","2025-08-29T11:26:17.387703Z","sms-00644","ham",0.771,"Probably gonna swing by in a wee bit","2025-08-29T11:26:17.387720Z"
1568,"1","2025-08-29T11:26:18.345741Z","sms-00645","ham",0.698,"Ya very nice. . .be ready on thursday","2025-08-29T11:26:18.345759Z"
1569,"1","2025-08-29T11:26:19.817429Z","sms-00646","ham",1.233,"Allo! We have braved the buses and taken on the trains and triumphed. I mean we‘re in b‘ham. Have a jolly good rest of week","2025-08-29T11:26:19.817448Z"
1570,"1","2025-08-29T11:26:21.226137Z","sms-00647","ham",1.142,"Watching cartoon, listening music &amp; at eve had to go temple &amp; church.. What about u?","2025-08-29T11:26:21.226152Z"
1571,"1","2025-08-29T11:26:22.325894Z","sms-00648","ham",0.848,"Do you mind if I ask what happened? You dont have to say if it is uncomfortable.","2025-08-29T11:26:22.325908Z"
1572,"1","2025-08-29T11:26:23.761127Z","sms-00649","spam",1.177,"PRIVATE! Your 2003 Account Statement for shows 800 un-redeemed S. I. M. points. Call 08715203694 Identifier Code: 40533 Expires 31/10/04","2025-08-29T11:26:23.761144Z"
1573,"1","2025-08-29T11:26:24.927828Z","sms-00650","ham",0.914,"No prob. I will send to your email.","2025-08-29T11:26:24.927844Z"
1574,"1","2025-08-29T11:26:26.413261Z","sms-00651","spam",1.243,"You have won ?1,000 cash or a ?2,000 prize! To claim, call09050000327. T&C: RSTM, SW7 3SS. 150ppm","2025-08-29T11:26:26.413279Z"
1575,"1","2025-08-29T11:26:27.648352Z","sms-00652","ham",0.986,"Thats cool! Sometimes slow and gentle. Sonetimes rough and hard :)","2025-08-29T11:26:27.648368Z"
1576,"1","2025-08-29T11:26:28.668522Z","sms-00653","ham",0.767,"I'm gonna say no. Sorry. I would but as normal am starting to panic about time. Sorry again! Are you seeing on Tuesday?","2025-08-29T11:26:28.668541Z"
1577,"1","2025-08-29T11:26:29.883709Z","sms-00654","ham",0.944,"Wait, do you know if wesleys in town? I bet she does hella drugs!","2025-08-29T11:26:29.883722Z"
1578,"1","2025-08-29T11:26:31.344663Z","sms-00655","ham",1.224,"Fine i miss you very much.","2025-08-29T11:26:31.344683Z"
1579,"1","2025-08-29T11:26:32.442095Z","sms-00656","ham",0.847,"Did u got that persons story","2025-08-29T11:26:32.442112Z"
1580,"1","2025-08-29T11:26:33.709796Z","sms-00657","ham",0.996,"Tell them the drug dealer's getting impatient","2025-08-29T11:26:33.709819Z"
1581,"1","2025-08-29T11:26:36.163079Z","sms-00658","ham",2.19,"Sun cant come to earth but send luv as rays. cloud cant come to river but send luv as rain. I cant come to meet U, but can send my care as msg to U. Gud evng","2025-08-29T11:26:36.163098Z"
1582,"1","2025-08-29T11:26:38.164839Z","sms-00659","ham",1.737,"You will be in the place of that man","2025-08-29T11:26:38.164858Z"
1583,"1","2025-08-29T11:26:40.493105Z","sms-00660","ham",2.075,"It doesnt make sense to take it there unless its free. If you need to know more, wikipedia.com","2025-08-29T11:26:40.493125Z"
1584,"1","2025-08-29T11:26:41.958613Z","sms-00661","spam",1.175,"88800 and 89034 are premium phone services call 08718711108","2025-08-29T11:26:41.958626Z"
1585,"1","2025-08-29T11:26:43.121416Z","sms-00662","ham",0.913,"Under the sea, there lays a rock. In the rock, there is an envelope. In the envelope, there is a paper. On the paper, there are 3 words... '","2025-08-29T11:26:43.121433Z"
1586,"1","2025-08-29T11:26:44.170387Z","sms-00663","ham",0.789,"Then mum's repent how?","2025-08-29T11:26:44.170402Z"
1587,"1","2025-08-29T11:26:45.168556Z","sms-00664","ham",0.738,"Sorry me going home first... Daddy come fetch ü later...","2025-08-29T11:26:45.168574Z"
1588,"1","2025-08-29T11:26:46.108507Z","sms-00665","ham",0.68,"Leave it de:-). Start Prepare for next:-)..","2025-08-29T11:26:46.108527Z"
1589,"1","2025-08-29T11:26:47.054340Z","sms-00666","ham",0.689,"Yes baby! We can study all the positions of the kama sutra ;)","2025-08-29T11:26:47.054357Z"
1590,"1","2025-08-29T11:26:47.954362Z","sms-00667","ham",0.65,"En chikku nange bakra msg kalstiya..then had tea/coffee?","2025-08-29T11:26:47.954380Z"
1591,"1","2025-08-29T11:26:48.893106Z","sms-00668","ham",0.682,"Carlos'll be here in a minute if you still need to buy","2025-08-29T11:26:48.893127Z"
1592,"1","2025-08-29T11:26:49.975784Z","sms-00669","ham",0.833,"This pay is  &lt;DECIMAL&gt;  lakhs:)","2025-08-29T11:26:49.975805Z"
1593,"1","2025-08-29T11:26:50.985757Z","sms-00670","ham",0.744,"Have a good evening! Ttyl","2025-08-29T11:26:50.985774Z"
1594,"1","2025-08-29T11:26:51.883625Z","sms-00671","ham",0.653,"Did u receive my msg?","2025-08-29T11:26:51.883644Z"
1595,"1","2025-08-29T11:26:53.023287Z","sms-00672","ham",0.872,"Ho ho - big belly laugh! See ya tomo","2025-08-29T11:26:53.023301Z"
1596,"1","2025-08-29T11:26:54.521080Z","sms-00673","spam",1.242,"SMS. ac sun0819 posts HELLO:""You seem cool, wanted to say hi. HI!!!"" Stop? Send STOP to 62468","2025-08-29T11:26:54.521099Z"
1597,"1","2025-08-29T11:26:56.094016Z","sms-00674","spam",1.308,"Get ur 1st RINGTONE FREE NOW! Reply to this msg with TONE. Gr8 TOP 20 tones to your phone every week just £1.50 per wk 2 opt out send STOP 08452810071 16","2025-08-29T11:26:56.094036Z"
1598,"1","2025-08-29T11:26:58.187057Z","sms-00675","ham",1.831,"Ditto. And you won't have to worry about me saying ANYTHING to you anymore. Like i said last night, you do whatever you want and i'll do the same. Peace.","2025-08-29T11:26:58.187077Z"
1599,"1","2025-08-29T11:26:59.310190Z","sms-00676","ham",0.863,"I've got  &lt;#&gt; , any way I could pick up?","2025-08-29T11:26:59.310206Z"
1600,"1","2025-08-29T11:27:00.703372Z","sms-00677","ham",1.135,"I dont knw pa, i just drink milk..","2025-08-29T11:27:00.703387Z"
1601,"1","2025-08-29T11:27:02.010931Z","sms-00678","ham",1.037,"Maybe?! Say hi to  and find out if  got his card. Great escape or wetherspoons? ","2025-08-29T11:27:02.010948Z"
1602,"1","2025-08-29T11:27:03.255238Z","sms-00679","ham",0.985,"Piggy, r u awake? I bet u're still sleeping. I'm going 4 lunch now...","2025-08-29T11:27:03.255256Z"
1603,"1","2025-08-29T11:27:04.237436Z","sms-00680","ham",0.723,"Cause I'm not freaky lol","2025-08-29T11:27:04.237453Z"
1604,"1","2025-08-29T11:27:06.059707Z","sms-00681","ham",1.569,"Missed your call cause I was yelling at scrappy. Miss u. Can't wait for u to come home. I'm so lonely today.","2025-08-29T11:27:06.059727Z"
1605,"1","2025-08-29T11:27:07.103293Z","sms-00682","ham",0.791,"What is this 'hex' place you talk of? Explain!","2025-08-29T11:27:07.103308Z"
1606,"1","2025-08-29T11:27:08.155675Z","sms-00683","ham",0.811,"Ü log off 4 wat. It's sdryb8i","2025-08-29T11:27:08.155697Z"
1607,"1","2025-08-29T11:27:09.375900Z","sms-00684","ham",0.958,"Is xy going 4 e lunch?","2025-08-29T11:27:09.375909Z"
1608,"1","2025-08-29T11:27:13.264010Z","sms-00685","spam",3.647,"Hi I'm sue. I am 20 years old and work as a lapdancer. I love sex. Text me live - I'm i my bedroom now. text SUE to 89555. By TextOperator G2 1DA 150ppmsg 18+","2025-08-29T11:27:13.264032Z"
1609,"1","2025-08-29T11:27:14.772918Z","sms-00686","ham",1.235,"I wanted to ask ü to wait 4 me to finish lect. Cos my lect finishes in an hour anyway.","2025-08-29T11:27:14.772940Z"
1610,"1","2025-08-29T11:27:15.776935Z","sms-00687","ham",0.737,"Have you finished work yet? :)","2025-08-29T11:27:15.776954Z"
1611,"1","2025-08-29T11:27:18.440812Z","sms-00688","ham",2.392,"Every King Was Once A Crying Baby And Every Great Building Was Once A Map.. Not Imprtant Where U r TODAY, BUT Where U Wil Reach TOMORW. Gud ni8","2025-08-29T11:27:18.440830Z"
1612,"1","2025-08-29T11:27:20.023584Z","sms-00689","ham",1.329,"Dear,Me at cherthala.in case u r coming cochin pls call bfore u start.i shall also reach accordingly.or tell me which day u r coming.tmorow i am engaged ans its holiday.","2025-08-29T11:27:20.023596Z"
1613,"1","2025-08-29T11:27:21.065368Z","sms-00690","ham",0.802,"Thanks love. But am i doing torch or bold.","2025-08-29T11:27:21.065385Z"
1614,"1","2025-08-29T11:27:22.503699Z","sms-00691","spam",1.176,"<Forwarded from 448712404000>Please CALL 08712404000 immediately as there is an urgent message waiting for you.","2025-08-29T11:27:22.503722Z"
1615,"1","2025-08-29T11:27:23.438429Z","sms-00692","ham",0.661,"Was the farm open?","2025-08-29T11:27:23.438449Z"
1616,"1","2025-08-29T11:27:25.358613Z","sms-00693","ham",1.647,"Sorry to trouble u again. Can buy 4d for my dad again? 1405, 1680, 1843. All 2 big 1 small, sat n sun. Thanx.","2025-08-29T11:27:25.358630Z"
1617,"1","2025-08-29T11:27:26.392297Z","sms-00694","ham",0.758,"My sister in law, hope you are having a great month. Just saying hey. Abiola","2025-08-29T11:27:26.392318Z"
1618,"1","2025-08-29T11:27:27.664665Z","sms-00695","ham",0.998,"Will purchase d stuff today and mail to you. Do you have a po box number?","2025-08-29T11:27:27.664685Z"
1619,"1","2025-08-29T11:27:28.822209Z","sms-00696","ham",0.902,"Ah poop. Looks like ill prob have to send in my laptop to get fixed cuz it has a gpu problem","2025-08-29T11:27:28.822230Z"
1620,"1","2025-08-29T11:27:29.890822Z","sms-00697","ham",0.797,"Good. Good job. I like entrepreneurs","2025-08-29T11:27:29.890839Z"
1621,"1","2025-08-29T11:27:31.062442Z","sms-00698","ham",0.895,"Aight, you close by or still down around alex's place?","2025-08-29T11:27:31.062458Z"
1622,"1","2025-08-29T11:27:32.248903Z","sms-00699","ham",0.925,"meet you in corporation st outside gap … you can see how my mind is working!","2025-08-29T11:27:32.248921Z"
1623,"1","2025-08-29T11:27:33.285853Z","sms-00700","ham",0.705,"Mum ask ü to buy food home...","2025-08-29T11:27:33.285869Z"
1624,"1","2025-08-29T11:27:34.235269Z","sms-00701","ham",0.673,"K..u also dont msg or reply to his msg..","2025-08-29T11:27:34.235287Z"
1625,"1","2025-08-29T11:27:35.107276Z","sms-00702","ham",0.604,"How much r ü willing to pay?","2025-08-29T11:27:35.107293Z"
1626,"1","2025-08-29T11:27:35.941690Z","sms-00703","ham",0.542,"Sorry, I'll call later","2025-08-29T11:27:35.941703Z"
1627,"1","2025-08-29T11:27:36.744533Z","sms-00704","ham",0.563,"What is important is that you prevent dehydration by giving her enough fluids","2025-08-29T11:27:36.744553Z"
1628,"1","2025-08-29T11:27:37.531364Z","sms-00705","ham",0.526,"Thats a bit weird, even ?- where is the do supposed to be happening? But good idea, sure they will be in pub!","2025-08-29T11:27:37.531384Z"
1629,"1","2025-08-29T11:27:38.470997Z","sms-00706","ham",0.664,"True dear..i sat to pray evening and felt so.so i sms'd you in some time...","2025-08-29T11:27:38.471015Z"
1630,"1","2025-08-29T11:27:39.450797Z","sms-00707","ham",0.707,"I don't think I can get away for a trek that long with family in town, sorry","2025-08-29T11:27:39.450815Z"
1631,"1","2025-08-29T11:27:40.375650Z","sms-00708","ham",0.658,"So when do you wanna gym harri","2025-08-29T11:27:40.375669Z"
1632,"1","2025-08-29T11:27:41.416898Z","sms-00709","ham",0.776,"Quite late lar... Ard 12 anyway i wun b drivin...","2025-08-29T11:27:41.416914Z"
1633,"1","2025-08-29T11:27:43.169085Z","sms-00710","spam",1.48,"To review and KEEP the fantastic Nokia N-Gage game deck with Club Nokia, go 2 www.cnupdates.com/newsletter. unsubscribe from alerts reply with the word OUT","2025-08-29T11:27:43.169104Z"
1634,"1","2025-08-29T11:27:44.753522Z","sms-00711","spam",1.296,"4mths half price Orange line rental & latest camera phones 4 FREE. Had your phone 11mths+? Call MobilesDirect free on 08000938767 to update now! or2stoptxt T&Cs","2025-08-29T11:27:44.753542Z"
1635,"1","2025-08-29T11:27:50.499913Z","sms-00712","ham",5.466,"Height of Confidence: All the Aeronautics professors wer calld &amp; they wer askd 2 sit in an aeroplane. Aftr they sat they wer told dat the plane ws made by their students. Dey all hurried out of d plane.. Bt only 1 didnt move... He said:""if it is made by my students,this wont even start........ Datz confidence..","2025-08-29T11:27:50.499929Z"
1636,"1","2025-08-29T11:27:53.186884Z","sms-00713","ham",2.405,"It just seems like weird timing that the night that all you and g want is for me to come smoke is the same day as when a shitstorm is attributed to me always coming over and making everyone smoke","2025-08-29T11:27:53.186909Z"
1637,"1","2025-08-29T11:27:56.241798Z","sms-00714","spam",2.781,"08714712388 between 10am-7pm Cost 10p","2025-08-29T11:27:56.241816Z"
1638,"1","2025-08-29T11:27:58.182135Z","sms-00715","ham",1.658,"Save yourself the stress. If the person has a dorm account, just send your account details and the money will be sent to you.","2025-08-29T11:27:58.182158Z"
1639,"1","2025-08-29T11:27:59.976576Z","sms-00716","ham",1.5,"He also knows about lunch menu only da. . I know","2025-08-29T11:27:59.976585Z"
1640,"1","2025-08-29T11:28:01.947537Z","sms-00717","ham",1.706,"When i have stuff to sell i.ll tell you","2025-08-29T11:28:01.947561Z"
1641,"1","2025-08-29T11:28:03.422854Z","sms-00718","spam",1.188,"+449071512431 URGENT! This is the 2nd attempt to contact U!U have WON £1250 CALL 09071512433 b4 050703 T&CsBCM4235WC1N3XX. callcost 150ppm mobilesvary. max£7. 50","2025-08-29T11:28:03.422869Z"
1642,"1","2025-08-29T11:28:05.905452Z","sms-00719","ham",2.201,"Book which lesson? then you msg me... I will call up after work or sth... I'm going to get specs. My membership is PX3748","2025-08-29T11:28:05.905469Z"
1643,"1","2025-08-29T11:28:07.248132Z","sms-00720","spam",1.075,"You have WON a guaranteed £1000 cash or a £2000 prize. To claim yr prize call our customer service representative on 08714712394 between 10am-7pm","2025-08-29T11:28:07.248153Z"
1644,"1","2025-08-29T11:28:08.906688Z","sms-00721","ham",1.405,"Macha dont feel upset.i can assume your mindset.believe me one evening with me and i have some wonderful plans for both of us.LET LIFE BEGIN AGAIN.call me anytime","2025-08-29T11:28:08.906707Z"
1645,"1","2025-08-29T11:28:10.005454Z","sms-00722","ham",0.819,"Oh is it? Send me the address","2025-08-29T11:28:10.005474Z"
1646,"1","2025-08-29T11:28:10.979364Z","sms-00723","ham",0.704,"S'fine. Anytime. All the best with it.","2025-08-29T11:28:10.979383Z"
